{
  "id": "baidu_image_classify_list",
  "url": "https://aip.baidubce.com/rest/2.0/image-classify/v1/animal",
  "private": "baidu_image_classify_key",
  "method": "POST",
  "requestContentType": "form",
  "args": [
    {
      "in": "query",
      "name": "access_token",
      "value": {
        "from": "origin",
        "content": "token"
      }
    },
    {
      "in": "body",
      "name": "imgUrl",
      "value": {
        "from": "origin",
        "content": "content"
      }
    }
  ]
}
